id,name
1501,"Organic Sprouted Rolled Oats, 24 oz"
1502,"Creamy Wheat Hot Cereal, 24 oz"
1503,"Organic Hot Cereal Quick Oats Rolled Oats, 42 oz"
1504,"Organic Instant Oatmeal Original 8 Pack, 11.3 oz"
1505,"Gluten-free Quinoa Hot Cereal Flakes, 12 oz"
1506,"Bear Naked Granola, Triple Berry, Kosher and Vegan, 12oz"
1507,"Steve's Paleogoods Paleokrunch Dark Chocolate Espresso Grainless Granola, 1.5 oz"
1508,"Cocoa & Coconut Muesli, 12 oz"
1509,"Bear Naked Granola, Fruit and Nut, Vegetarian and Kosher, 12oz"
1510,"Organic Honey Nut Granola, 36 oz"
1511,"Strawberries And Cream Overnight Oats, 6 oz"
1512,"Strawberry Overnight Oats, 5 oz"
1513,"Kellogg's Frosted Mini-Wheats Little Bites Breakfast Cereal, Original, Family Pack, Excellent Source of Fiber, 23oz"
1514,"Kellogg's Frosted Mini-Wheats Breakfast Cereal, Original, Good Source of 7 Vitamins and Minerals, 18oz"
1515,"Pancake Waffle Mix Paleo, 13 oz"
1516,Nature's Path Grain Free Cinnamon Apple Oatmeal - 6.21oz
1517,"Brown Sugar Maple Instant Oatmeal, 11.3 oz"
1518,"Pancake Waffle Mix Protein, 14 oz"
1519,"Golden Chai Granola, 12 oz"
1520,"Kellogg's Apple Jacks Jumbo Snax Cereal, Original, Perfect for Anytime Snacking, 12ct 5.4oz"
1521,"Kellogg's Froot Loops Jumbo Snax Cereal, Original, Perfect for Anytime Snacking, 12ct 5.4oz"
1522,"No Added Sugar Coconut Cashew Granola, 14 oz"
1523,"Kellogg's Frosted Mini-Wheats Little Bites Breakfast Cereal, Chocolate, Family Pack, Good Source of 7 Vitamins and Minerals, 23oz"
1524,"Protein & Fiber Hot Oatmeal Farmer's Market Berry Crumble 6ct Box, 10.6 oz"
1525,"Great Value Awake Cereal, Fruit & Yogurt, 12.5 oz"
1526,"Organic French Vanilla Almond Granola, 13 oz"
1527,"Great Value Bran Flakes Cereal, 15.6 oz"
1528,"Organic Frosted Flakes, 27 ounce"
1529,"Organic Frosted Buckwheat & Cocoa Flakes Cereal, 14.5 oz"
1530,"Kodiak Cakes Maple & Brown Sugar Oatmeal, 1.76 oz, 6 count"
1531,"Kellogg's Krave Breakfast Cereal, Chocolate, Family Size, Filling Made with Real Chocolate, 17.3oz"
1532,"Quaker Instant Oatmeal, Apples & Cranberries, 1.79 oz Cup"
1533,"Malt-O-Meal Berry Colossal Crunch® Breakfast Cereal, Bagged Cereal, 56 Ounce - 1 count"
1534,"S'mores Granola, 12 oz"
1535,"Kellogg's Froot Loops Breakfast Cereal, Original, Mega Size, Low Fat Food, 28oz"
1536,"Organic Cereal Honey Flakes & Oat Clusters, 12 oz"
1537,Kodiak Cakes Chocolate Peanut Butter Oatmeal in a Cup - 2.25oz
1538,"Malt-O-Meal Breakfast Cereal, Coco Roos, 38 Oz Zip Bag"
1539,"Trix Trolls with Marshmallows Breakfast Cereal, 16 oz"
1540,"Kellogg's Frosted Flakes Breakfast Cereal, 8 Vitamins and Minerals, Kids Snacks, Honey Nut, 24.5oz, 1 Box"
1541,"Collagen Oatmeal Pouch - Vanilla Pecan, 8 oz"
1542,"Malt-O-Meal Breakfast Cereal, Chocolatey Chip Cookie, 34oz Bag"
1543,"Kellogg's Apple Jacks Breakfast Cereal in a Cup, Original, Single Serve, 1.5oz"
1544,"Organic Honey Nut O's, 9.5 oz"
1545,"Post Cocoa PEBBLES Cereal, Gluten Free, Cocoa Flavored Crispy Rice Cereal, 15 Ounce"
1546,"Flax Plus Maple Pecan Crunch Cereal, 11.5 oz"
1547,"Great Value, Cinnamon Crunch Breakfast Cereal, 20.25 oz"
1548,"Cinnamon Toast Crunch Remix, Multipack, Snack Mix, 10 Pouches"
1549,Better Oats Apples & Cinnamon Steel Cut Oats - 12.3oz
1550,"Malt-O-Meal Breakfast Cereal, Cinnamon Toasters, 37 Oz, Bag"