id,name
1201,"Dry Roasted Baru Nuts, 6 oz"
1202,"Emerald Nuts Natural Walnuts and Almonds, 100 Calorie Packs, 10 Ct"
1203,"Great Value Whole Almonds, 16 oz"
1204,"Jumbo Roasted & Unsalted Cashews, 9 oz"
1205,"Great Value Dried Apricots, 6 oz"
1206,"Sun-Maid California Golden Raisins, 15 Oz"
1207,Blue Diamond Lightly Salted Low-Sodium Almonds - 1.5oz
1208,"Planters Lightly Salted Mixed Nuts Less Than 50% Peanuts with Peanuts, Almonds, Cashews, Hazelnuts & Pecans, 15 oz Canister"
1209,Blue Diamond Lightly Salted Almonds - 25oz
1210,Planters Deluxe Lightly Salted Mixed Nuts-15.25oz
1211,"Planters Deluxe Lightly Salted Mixed Nuts with Cashews, Almonds, Hazelnuts, Pecans & Pistachios, 15.25 oz Canister"
1212,Planters Nut-Rition Men's Health Mix - 7ct
1213,"Pistachio Cashew Almond Mix, 9 oz"
1214,"Planters Dry Roasted Peanuts, 16 oz Jar"
1215,Planters Pistachio Blend - 10oz
1216,Planters Honey Roasted Peanuts - 2lb
1217,Good Sense Roasted Salted Cashews - 5oz
1218,"Blue Diamond Almonds, Smokehouse 14 oz bag"
1219,Sea Salt Roasted Mixed Nuts - 30oz - Good & Gather™
1220,Honey Roasted Cashews - 1.5oz - Good & Gather™
1221,"Roasted & Salted Almonds, 32 ounce"
1222,"Blue Diamond Almonds, Habanero BBQ 14 oz"
1223,"Roasted Salted Cashews, 7 oz"
1224,"Vermont Maple Sugar & Sea Salt Pumpkin Seeds, 4 oz"
1225,"Keto Energy Nut Blend, 9 oz"
1226,"Santa Barbara Pistachio Organic Chile Lemon Pistachios, 12 oz"
1227,"Organic Furikake State Bird Crunch, 3.5 oz"
1228,Orchard Valley Harvest Antioxidant Mix - 8oz
1229,Planters Halves And Pieces Cashews - 14oz
1230,"Planters Cashews Halves & Pieces, 1.63 lb Container"
1231,"Berrylicious Raw Trail Mix Blend, 10 oz"
1232,"Cashews, Roasted & Salted Canister, 8.5 oz"
1233,"Thai Curry Cashews, 12 ounce"
1234,"Peanuts, Honey Roasted (Canister), 12 oz"
1235,"Organic Roasted & Salted Sunflower Kernels, 12 ounce"
1236,"Sea Salt & Vinegar Italian Snacking Lupini Beans, 5.3 oz"
1237,Good Sense Milk Chocolate Almonds - 13oz
1238,"Planters Cashews Halves & Pieces, 8 oz Canister"
1239,"Peanut Patch Hot & Spicy Boiled Peanuts, 25 oz"
1240,"Blueberry Blaze Trail Mix, 14 ounce"
1241,"Roasted & Salted Macadamia Nuts, 8 ounce"
1242,Krave Smoked Chipolte Plant Based Jerky - 2.2oz
1243,"Glazed Cashews With Cacao Nibs, 8 oz"
1244,"Double Feature Trail Mix, 32 oz"
1245,"Falafel Crunchy Chickpeas, 6 oz"
1246,"Ocean Spray, Greek Yogurt Cranberry Bites, 8oz Resealable Pouch"
1247,Love Corn Habanero Crunchy Corn Snack - 1.6oz
1248,"Nut Clusters, Pistachio, 10 oz"
1249,"Spicy Pub Mix, 12.5 oz"
1250,"Honey Roasted Chickpea Snacks, 5 oz"