id,name
151,"Organic Beef Bone Broth, 24 fl oz"
152,"Organic Beef Bone Broth, 24 fl oz"
153,"Broth Vietnamese Pho Beef Bone, 10 fl oz"
154,"Organic Creamy Butternut Squash Soup Low Sodium, 32 fl oz"
155,"Gluten Free Veggie Noodle Soup, 15 oz"
156,"Organic Broth, Chicken - Low Sodium, 32 fl oz"
157,"Organic Lentil Vegetable With Kale Vegan Soup, 18 oz"
158,"Organic Chicken Turmeric Bone Broth Cup, 10 fl oz"
159,Pacific Foods Organic Unsalted Chicken Culinary Stock - 32oz
160,"Turmeric Ginger Chicken Bone Broth, 16.9 oz"
161,"Chickpea Soup, 19.4 oz"
162,"Organic Chili Beans, 15 oz"
163,"No Chicken Noodle Soup, 14.1 oz"
164,Natural Smoked Oysters with Chili Pepper
165,Amy's Organic Medium Chili 14.7oz
166,"Ramen Broth, 32 fl. oz."
167,"Split Pea Soup, 24 oz"
168,"Organic Vegetable Quinoa Soup, 17 oz"
169,Amy's Organic Lentil Soup 14.5oz
170,"Spicy Sesame Ramen, 12.7 oz"
171,"Miso Soba Noodle Soup, 22 oz"
172,"Old School Vegetable Soup, 24 oz"
173,"Butter Chicken Bone Broth, 16.9 oz"
174,"Black Bean Chili Quinoa Soup, 24 oz"
175,"Chick'n & Rice Soup, 15 oz"
176,"Simply Asia Japanese Inspired Ramen Soy Ginger Chicken Broth, 26 fl oz"
177,Dennison's 98% Fat Free Turkey Chili with Beans - 15oz
178,"Alder Smoked Wild Salmon Chowder, 10 oz"
179,"Organic Fire Roasted Southwestern Vegetable Soup, 14.3 oz"
180,"Hormel 100% Natural White Chicken Chili With Beans, 15 Oz"
181,"Campbell's Condensed Healthy Request Vegetable Beef Soup, 10.5 Ounce Can"
182,"Organic White Bean Kale & Millet Soup, 17 oz"
183,Dennison's Original Chili Con Carne with Beans 15oz
184,"Campbell's Condensed Vegetable Beef Soup, 10.5 oz. Can"
185,"Hormel Chili With Beans, 15 Oz Microwave Cup"
186,"Razor Clam Bacon Chowder, 10 oz"
187,"Hormel Chili With Beans, 15 Oz Can"
188,Creamy Tomato Basil Soup - 16oz - Good & Gather™
189,"Campbell's Chunky Soup, Chipotle Chicken & Corn Chowder, 18.8 Ounce Can"
190,"Campbell's Condensed Double Noodle Soup, 11 oz."
191,"Organic Cream Of Mushroom Soup, 14.1 oz"
192,"Campbell's Chunky Soup, Pub-Style Chicken Pot Pie Soup, 18.8 Ounce Can"
193,"Swanson Beef Broth, 32 oz. Carton"
194,Maggi Chicken Flavored Pasta Soup Mix 2.11 oz.
195,"Brown Gravy Cubes 6ct, 2.53 oz"
196,Campbell's Tomato Soup Microwavable Cup - 4pk/28oz
197,"Organic Roasted Red Pepper & Tomato Soup, 32 fl oz"
198,Progresso South West Tortilla Dry Soup Mix - 7oz
199,"Nongshim Bowl Noodle Hot & Spicy Beef Ramyun Ramen Noodle Soup Bowl, 3.03oz X 1 Count"
200,Maruchan Instant Lunch Lime Flavor with Shrimp Soup - 2.25oz